{
  "schemaVersion": "1.0.0",
  "project": {
    "id": "11111111-1111-4111-8111-111111111111",
    "name": "Sample hall",
    "metadata": {
      "createdAt": "2026-01-01T00:00:00.000Z",
      "updatedAt": "2026-01-01T00:00:00.000Z",
      "description": "One room, a stage, and a food-court zone.",
      "generator": "openvenue"
    }
  },
  "coordinateSystem": {
    "lengthUnit": "metres",
    "upAxis": "Y",
    "handedness": "right",
    "angleUnit": "radians"
  },
  "assets": [
    {
      "id": "bbbbbbbb-bbbb-4bbb-8bbb-bbbbbbbbbbbb",
      "name": "Chair",
      "format": "glb",
      "uri": "assets/chair.glb",
      "license": "CC-BY-4.0",
      "polygonBudget": 2000
    }
  ],
  "venue": {
    "id": "22222222-2222-4222-8222-222222222222",
    "name": "Sample hall",
    "floors": [
      {
        "id": "33333333-3333-4333-8333-333333333333",
        "name": "Ground floor",
        "level": 0,
        "elevation": 0,
        "height": 4,
        "rooms": [
          {
            "id": "77777777-7777-4777-8777-777777777777",
            "name": "Hall",
            "boundary": [
              { "x": 0, "z": 0 },
              { "x": 20, "z": 0 },
              { "x": 20, "z": 15 },
              { "x": 0, "z": 15 }
            ],
            "wallIds": ["55555555-5555-4555-8555-555555555555"]
          }
        ],
        "walls": [
          {
            "id": "55555555-5555-4555-8555-555555555555",
            "start": { "x": 0, "z": 0 },
            "end": { "x": 20, "z": 0 },
            "thickness": 0.2,
            "height": 4,
            "openings": [
              {
                "id": "66666666-6666-4666-8666-666666666666",
                "kind": "door",
                "offset": 2,
                "width": 1.2,
                "height": 2.2,
                "sill": 0
              }
            ]
          }
        ],
        "objects": [
          {
            "id": "88888888-8888-4888-8888-888888888888",
            "type": "stage",
            "name": "Main stage",
            "transform": {
              "position": { "x": 10, "y": 0, "z": 12 },
              "rotation": { "x": 0, "y": 0, "z": 0 },
              "scale": { "x": 1, "y": 1, "z": 1 }
            },
            "dimensions": { "width": 8, "height": 0.8, "depth": 3 }
          }
        ],
        "zones": [
          {
            "id": "aaaaaaaa-aaaa-4aaa-8aaa-aaaaaaaaaaaa",
            "type": "zone",
            "name": "Food Court",
            "boundary": [
              { "x": 0, "z": 0 },
              { "x": 6, "z": 0 },
              { "x": 6, "z": 5 },
              { "x": 0, "z": 5 }
            ],
            "interaction": {
              "type": "info-panel",
              "contentRef": "content/food-court.json"
            }
          }
        ]
      }
    ],
    "spawnPoints": [
      {
        "id": "44444444-4444-4444-8444-444444444444",
        "name": "Entrance",
        "floorId": "33333333-3333-4333-8333-333333333333",
        "position": { "x": 2, "y": 0, "z": 1 },
        "rotationY": 0,
        "role": "visitor"
      }
    ],
    "navigation": {
      "walkableAreas": [
        {
          "id": "cccccccc-cccc-4ccc-8ccc-cccccccccccc",
          "floorId": "33333333-3333-4333-8333-333333333333",
          "boundary": [
            { "x": 0.5, "z": 0.5 },
            { "x": 19.5, "z": 0.5 },
            { "x": 19.5, "z": 14.5 },
            { "x": 0.5, "z": 14.5 }
          ]
        }
      ],
      "waypoints": [
        {
          "id": "dddddddd-dddd-4ddd-8ddd-dddddddddddd",
          "floorId": "33333333-3333-4333-8333-333333333333",
          "position": { "x": 3, "y": 0, "z": 2 },
          "links": []
        }
      ]
    }
  }
}
